{"$schema":"https://json-schema.org/draft/2020-12/schema","type":"object","required":["object_id","object_type","classification","provenance","lifecycle_status","readiness_status","blocking_reasons","dependencies","placeholders","validation","data"],"properties":{"object_id":{"type":"string","minLength":1},"object_type":{"type":"string"},"classification":{"enum":["CUSTOMIZING","MASTER_DATA","TRANSACTION","REFERENCE_DATA"]},"scenario_id":{"type":["string","null"]},"provenance":{"type":"array","minItems":1,"items":{"$ref":"source_ref.schema.json"}},"lifecycle_status":{"enum":["RAW","EXTRACTED","NORMALIZED","VALIDATED","REJECTED"]},"readiness_status":{"enum":["READY","BLOCKED"]},"blocking_reasons":{"type":"array","items":{"$ref":"blocking_reason.schema.json"}},"dependencies":{"type":"array","items":{"$ref":"dependency.schema.json"}},"placeholders":{"type":"array","items":{"$ref":"placeholder.schema.json"}},"validation":{"$ref":"validation.schema.json"},"data":{"type":"object"}}}
